{
  "schema_version": "1.0",
  "suite": "kupo-keep-suite",
  "arm": {
    "label": "system-light",
    "fix_hook": "/home/rynaro/workspace/oss/agents/eidolons/evals/hooks/keep-system.sh",
    "env": {
      "EIDOLONS_EVAL_MODEL": "haiku",
      "EIDOLONS_SANDBOX_MODEL_TIER": "light"
    },
    "control": true
  },
  "started_at": "2026-07-03T18:35:49Z",
  "k": 3,
  "tasks": [
    {
      "id": "keep-import-path-fix",
      "resolved": true,
      "passes": 3,
      "attempts": 3
    },
    {
      "id": "keep-rename-call-consistency",
      "resolved": true,
      "passes": 3,
      "attempts": 3
    },
    {
      "id": "keep-lockfile-pin-bump",
      "resolved": true,
      "passes": 3,
      "attempts": 3
    },
    {
      "id": "keep-config-key-edit",
      "resolved": true,
      "passes": 3,
      "attempts": 3
    },
    {
      "id": "keep-one-line-arithmetic",
      "resolved": true,
      "passes": 3,
      "attempts": 3
    },
    {
      "id": "keep-grep-replace-multi",
      "resolved": true,
      "passes": 3,
      "attempts": 3
    },
    {
      "id": "keep-json-syntax-fix",
      "resolved": false,
      "passes": 0,
      "attempts": 3
    },
    {
      "id": "keep-multi-block-edit",
      "resolved": true,
      "passes": 3,
      "attempts": 3
    },
    {
      "id": "keep-json-value-edit",
      "resolved": false,
      "passes": 0,
      "attempts": 3
    },
    {
      "id": "keep-env-key-rename",
      "resolved": true,
      "passes": 3,
      "attempts": 3
    },
    {
      "id": "keep-relative-path-fix",
      "resolved": true,
      "passes": 3,
      "attempts": 3
    },
    {
      "id": "keep-typo-fix",
      "resolved": true,
      "passes": 3,
      "attempts": 3
    }
  ],
  "resolved_rate": 0.8333333333333334,
  "pass_k_rate": 0.8333333333333334,
  "harness": {
    "nexus_version": "1.49.0",
    "smoke": false
  }
}
